{
  "titel": "Tag der Blasmusik 2020",
  "datum": "2020-08-15",
  "tags": [
    "Bilder",
    "Verein"
  ],
  "beschreibung": "Ein Rückblick auf den Tag der Blasmusik.",
  "albums": [
    {
      "id": "2020_Tag_der_Blasmusik",
      "titel": "Tdb 2020",
      "datum": "",
      "bilder": []
    }
  ]
}
