{
  "titel": "210 Jahre Jubiläum",
  "datum": "2026-06-28",
  "tags": ["Bilder", "Feier"],
  "beschreibung": "Bilder zur Jubiläumsfeier 210 Jahre Trachtenkapelle Riezlern im neu eröffneten Walserpark in Riezlern.",
  "albums": [
    {
      "id": "2026_210_jahre",
      "titel": "210 Jahre",
      "datum": "",
      "bilder": [
        "albums/6255.jpg",
        "albums/6266.jpg",
        "albums/6280.jpg",
        "albums/6283.jpg",
        "albums/6286.jpg",
        "albums/6291.jpg",
        "albums/6310.jpg",
        "albums/6312.jpg",
        "albums/6315.jpg",
        "albums/6320.jpg",
        "albums/6324.jpg",
        "albums/6329.jpg",
        "albums/6331.jpg",
        "albums/6337.jpg",
        "albums/6347.jpg",
        "albums/6361.jpg",
        "albums/6382.jpg",
        "albums/6401.jpg",
        "albums/6423.jpg",
        "albums/6430.jpg",
        "albums/6437.jpg",
        "albums/6466.jpg",
        "albums/6494.jpg",
        "albums/6497.jpg",
        "albums/6500.jpg",
        "albums/6517.jpg",
        "albums/6526.jpg",
        "albums/6533.jpg",
        "albums/6542.jpg",
        "albums/6546.jpg",
        "albums/6548.jpg",
        "albums/6550.jpg",
        "albums/6559.jpg",
        "albums/6582.jpg",
        "albums/6623.jpg",
        "albums/6640.jpg",
        "albums/6652.jpg",
        "albums/6653.jpg",
        "albums/6657.jpg",
        "albums/6676.jpg",
        "albums/6683.jpg",
        "albums/6688.jpg",
        "albums/6695.jpg",
        "albums/6698.jpg",
        "albums/6703.jpg",
        "albums/6726.jpg",
        "albums/6728.jpg",
        "albums/6743.jpg",
        "albums/6753.jpg",
        "albums/6757.jpg",
        "albums/6767.jpg",
        "albums/6809.jpg",
        "albums/6868.jpg",
        "albums/6871.jpg",
        "albums/6900.jpg",
        "albums/6902.jpg"
      ]
    }
  ]
}
