{
  "titel": "Jahreskonzert 2025 – Fantasie",
  "datum": "2025-05-10",
  "tags": [
    "Konzert",
    "Jahreskonzert"
  ],
  "beschreibung": "Fantasie Jahreskonzert 2025.",
  "inhalt": "<p><b>Was wäre Musik ohne Fantasie?</b> Sie beginnt mit einer Idee, einem Gedanken, einer Vision – und entfaltet sich zu Klang. Gleichzeitig öffnet sie Türen in unserer Vorstellung, lässt Bilder entstehen und Geschichten lebendig werden, die uns inspirieren.</p><p>Die Trachtenkapelle Riezlern lädt am 10. Mai 2025 um 20:00 Uhr im Walserhaus Hirschegg ein, sich bei ihrem Konzert von Fantasie und Inspiration beflügeln zu lassen. Dabei erklingen Stücke wie „Imagasy“, „Free World Fantasy“, „Der Zauberer von Oz“, „Künstlerleben“ und Filmmusik aus bekannten Fantasyklassikern unter der musikalischen Leitung von Katrin Berchtold.</p><p>Musik und Fantasie werden an diesem Abend nicht nur hörbar, sondern auch sichtbar: die 20jährige Kleinwalsertaler Künstlerin Christina Elsäßer, Artist in Residence des Karl Max Kessler Archivs lässt ihrer Fantasie live freien Lauf. Inspiriert von den Klängen der Trachtenkapelle Riezlern zeigt sie in Echtzeit, welche Bilder die Musik in ihr entstehen lässt.</p>",
  "detailbild": "images/poster.png",
  "concert": {
    "titel": "Jahreskonzert 2025 – Fantasie",
    "datum": "2025-05-10",
    "beschreibung": "Das Programm unseres Jahreskonzerts 2025 unter dem Motto Fantasie."
  }
}
