{
  "titel": "Sommerkonzerte 2020",
  "datum": "2020",
  "tags": [
    "Bilder",
    "Sommerkonzerte"
  ],
  "beschreibung": "Bilder und Eindrücke aus den Sommerkonzerten.",
  "albums": [
    {
      "id": "2020_Sommerkonzerte",
      "titel": "Sommerkonzerte 2020",
      "datum": "",
      "bilder": []
    }
  ]
}
