{
  "titel": "Jahreskonzert 2026 – Der große Traum",
  "datum": "2026-04-25",
  "tags": [
    "Konzert",
    "Jahreskonzert"
  ],
  "beschreibung": "Unser Jahreskonzert 2026 unter dem Motto „Der große Traum“.",
  "inhalt":"Hier steht ein <i>seeeeeeeeeeeeeeeeeeeeeeeeeeehr</i> langer Fließtext....."
}
