{
  "titel": "Ein Abend am Broadway",
  "datum": "2013",
  "tags": [
    "Bilder",
    "Konzert"
  ],
  "beschreibung": "Bilder aus dem Konzertjahr 2013.",
  "albums": [
    {
      "id": "2013_Ein_Abend_am_Broadway",
      "titel": "Bilder 2013",
      "datum": "",
      "bilder": [
        "albums/2013_Ein_Abend_am_Broadway/IMG_5797.jpg",
        "albums/2013_Ein_Abend_am_Broadway/IMG_5799.jpg",
        "albums/2013_Ein_Abend_am_Broadway/IMG_5800.jpg",
        "albums/2013_Ein_Abend_am_Broadway/IMG_5806.jpg",
        "albums/2013_Ein_Abend_am_Broadway/IMG_5807.jpg",
        "albums/2013_Ein_Abend_am_Broadway/IMG_5810.jpg",
        "albums/2013_Ein_Abend_am_Broadway/IMG_5811.jpg",
        "albums/2013_Ein_Abend_am_Broadway/IMG_5819.jpg",
        "albums/2013_Ein_Abend_am_Broadway/IMG_5820.jpg",
        "albums/2013_Ein_Abend_am_Broadway/IMG_5831.jpg",
        "albums/2013_Ein_Abend_am_Broadway/IMG_5837.jpg",
        "albums/2013_Ein_Abend_am_Broadway/IMG_5841.jpg",
        "albums/2013_Ein_Abend_am_Broadway/IMG_5842.jpg",
        "albums/2013_Ein_Abend_am_Broadway/IMG_5845.jpg",
        "albums/2013_Ein_Abend_am_Broadway/IMG_5853.jpg",
        "albums/2013_Ein_Abend_am_Broadway/IMG_5856.jpg",
        "albums/2013_Ein_Abend_am_Broadway/IMG_5858.jpg",
        "albums/2013_Ein_Abend_am_Broadway/IMG_5860.jpg",
        "albums/2013_Ein_Abend_am_Broadway/IMG_5862.jpg",
        "albums/2013_Ein_Abend_am_Broadway/IMG_5867.jpg",
        "albums/2013_Ein_Abend_am_Broadway/IMG_5868.jpg",
        "albums/2013_Ein_Abend_am_Broadway/IMG_5871.jpg",
        "albums/2013_Ein_Abend_am_Broadway/IMG_5872.jpg",
        "albums/2013_Ein_Abend_am_Broadway/IMG_5875.jpg",
        "albums/2013_Ein_Abend_am_Broadway/IMG_5876.jpg",
        "albums/2013_Ein_Abend_am_Broadway/IMG_5878.jpg",
        "albums/2013_Ein_Abend_am_Broadway/IMG_5881.jpg",
        "albums/2013_Ein_Abend_am_Broadway/IMG_5884.jpg",
        "albums/2013_Ein_Abend_am_Broadway/IMG_5885.jpg",
        "albums/2013_Ein_Abend_am_Broadway/IMG_5886.jpg",
        "albums/2013_Ein_Abend_am_Broadway/IMG_5887.jpg",
        "albums/2013_Ein_Abend_am_Broadway/IMG_5888.jpg",
        "albums/2013_Ein_Abend_am_Broadway/IMG_5891.jpg",
        "albums/2013_Ein_Abend_am_Broadway/IMG_5892.jpg",
        "albums/2013_Ein_Abend_am_Broadway/IMG_5895.jpg",
        "albums/2013_Ein_Abend_am_Broadway/IMG_5897.jpg",
        "albums/2013_Ein_Abend_am_Broadway/IMG_5898.jpg",
        "albums/2013_Ein_Abend_am_Broadway/IMG_5899.jpg",
        "albums/2013_Ein_Abend_am_Broadway/IMG_5900.jpg",
        "albums/2013_Ein_Abend_am_Broadway/IMG_5902.jpg",
        "albums/2013_Ein_Abend_am_Broadway/IMG_5903.jpg",
        "albums/2013_Ein_Abend_am_Broadway/IMG_5904.jpg",
        "albums/2013_Ein_Abend_am_Broadway/IMG_5905.jpg",
        "albums/2013_Ein_Abend_am_Broadway/IMG_5906.jpg",
        "albums/2013_Ein_Abend_am_Broadway/IMG_5907.jpg",
        "albums/2013_Ein_Abend_am_Broadway/IMG_5909.jpg",
        "albums/2013_Ein_Abend_am_Broadway/IMG_5915.jpg",
        "albums/2013_Ein_Abend_am_Broadway/IMG_5916.jpg",
        "albums/2013_Ein_Abend_am_Broadway/IMG_5919.jpg",
        "albums/2013_Ein_Abend_am_Broadway/IMG_5925.jpg",
        "albums/2013_Ein_Abend_am_Broadway/IMG_5927.jpg",
        "albums/2013_Ein_Abend_am_Broadway/IMG_5928.jpg",
        "albums/2013_Ein_Abend_am_Broadway/IMG_5929.jpg",
        "albums/2013_Ein_Abend_am_Broadway/IMG_5930.jpg",
        "albums/2013_Ein_Abend_am_Broadway/IMG_5931.jpg",
        "albums/2013_Ein_Abend_am_Broadway/IMG_5932.jpg",
        "albums/2013_Ein_Abend_am_Broadway/IMG_5934.jpg",
        "albums/2013_Ein_Abend_am_Broadway/IMG_5936.jpg",
        "albums/2013_Ein_Abend_am_Broadway/IMG_5937.jpg",
        "albums/2013_Ein_Abend_am_Broadway/IMG_5938.jpg",
        "albums/2013_Ein_Abend_am_Broadway/IMG_5939.jpg",
        "albums/2013_Ein_Abend_am_Broadway/IMG_5942.jpg",
        "albums/2013_Ein_Abend_am_Broadway/IMG_5943.jpg"
      ]
    }
  ]
}
