{
  "titel": "Sommerkonzerte 2013",
  "datum": "2013",
  "tags": [
    "Bilder",
    "Sommerkonzerte"
  ],
  "beschreibung": "Sommerliche Konzertmomente aus dem Jahr 2013.",
  "albums": [
    {
      "id": "2013_Sommerkonzerte",
      "titel": "2013 Sommer",
      "datum": "",
      "bilder": [
        "albums/2013_Sommerkonzerte/_P2P0994.jpg",
        "albums/2013_Sommerkonzerte/_P2P1013.jpg",
        "albums/2013_Sommerkonzerte/_P2P1015.jpg",
        "albums/2013_Sommerkonzerte/_P2P1018.jpg",
        "albums/2013_Sommerkonzerte/_P2P1029.jpg",
        "albums/2013_Sommerkonzerte/_P2P1031.jpg",
        "albums/2013_Sommerkonzerte/_P2P1053.jpg",
        "albums/2013_Sommerkonzerte/_P2P1062.jpg",
        "albums/2013_Sommerkonzerte/_P2P1064.jpg",
        "albums/2013_Sommerkonzerte/_P2P1069.jpg",
        "albums/2013_Sommerkonzerte/_P2P1070.jpg",
        "albums/2013_Sommerkonzerte/_P2P1072.jpg",
        "albums/2013_Sommerkonzerte/_P2P1078.jpg",
        "albums/2013_Sommerkonzerte/_P2P1081.jpg",
        "albums/2013_Sommerkonzerte/_P2P1084.jpg",
        "albums/2013_Sommerkonzerte/_P2P1086.jpg",
        "albums/2013_Sommerkonzerte/_P2P1088.jpg",
        "albums/2013_Sommerkonzerte/_P2P1091.jpg",
        "albums/2013_Sommerkonzerte/_P2P1093.jpg",
        "albums/2013_Sommerkonzerte/_P2P1095.jpg",
        "albums/2013_Sommerkonzerte/_P2P1111.jpg",
        "albums/2013_Sommerkonzerte/_P2P1116.jpg",
        "albums/2013_Sommerkonzerte/_P2P1117.jpg",
        "albums/2013_Sommerkonzerte/_P2P1123 2.jpg",
        "albums/2013_Sommerkonzerte/_P2P1130 2.jpg",
        "albums/2013_Sommerkonzerte/_P2P1132 2.jpg",
        "albums/2013_Sommerkonzerte/_P2P1133 2.jpg",
        "albums/2013_Sommerkonzerte/_P2P1136 2.jpg",
        "albums/2013_Sommerkonzerte/_P2P1139 2.jpg",
        "albums/2013_Sommerkonzerte/_P2P1140 2.jpg",
        "albums/2013_Sommerkonzerte/_P2P1143 2.jpg",
        "albums/2013_Sommerkonzerte/_P2P1144 2.jpg",
        "albums/2013_Sommerkonzerte/_P2P1145 2.jpg",
        "albums/2013_Sommerkonzerte/_P2P1146 2.jpg",
        "albums/2013_Sommerkonzerte/_P2P1149 2.jpg",
        "albums/2013_Sommerkonzerte/_P2P1151 2.jpg",
        "albums/2013_Sommerkonzerte/_P2P1157 2.jpg",
        "albums/2013_Sommerkonzerte/_P2P1158 2.jpg",
        "albums/2013_Sommerkonzerte/_P2P1167 2.jpg",
        "albums/2013_Sommerkonzerte/_P2P1168 2.jpg",
        "albums/2013_Sommerkonzerte/_P2P1173 2.jpg",
        "albums/2013_Sommerkonzerte/_P2P1175 2.jpg",
        "albums/2013_Sommerkonzerte/_P2P1179 2.jpg",
        "albums/2013_Sommerkonzerte/_P2P1183 2.jpg",
        "albums/2013_Sommerkonzerte/_P2P1186 2.jpg",
        "albums/2013_Sommerkonzerte/_P2P1194 2.jpg",
        "albums/2013_Sommerkonzerte/_P2P1195 2.jpg",
        "albums/2013_Sommerkonzerte/_P2P1196 2.jpg",
        "albums/2013_Sommerkonzerte/_P2P1205 2.jpg",
        "albums/2013_Sommerkonzerte/_P2P1216 2.jpg",
        "albums/2013_Sommerkonzerte/_P2P1218 2.jpg",
        "albums/2013_Sommerkonzerte/_P2P1237 2.jpg",
        "albums/2013_Sommerkonzerte/_P2P1244 2.jpg",
        "albums/2013_Sommerkonzerte/_P2P1245 2.jpg",
        "albums/2013_Sommerkonzerte/_P2P1252 2.jpg",
        "albums/2013_Sommerkonzerte/_P2P1253 2.jpg",
        "albums/2013_Sommerkonzerte/_P2P1255 2.jpg",
        "albums/2013_Sommerkonzerte/_P2P1256 2.jpg",
        "albums/2013_Sommerkonzerte/_P2P1264 2.jpg",
        "albums/2013_Sommerkonzerte/_P2P1302 2.jpg",
        "albums/2013_Sommerkonzerte/_P2P1304 2.jpg",
        "albums/2013_Sommerkonzerte/_P2P1310 2.jpg",
        "albums/2013_Sommerkonzerte/_P2P1316 2.jpg",
        "albums/2013_Sommerkonzerte/_P2P1318 2.jpg",
        "albums/2013_Sommerkonzerte/_P2P1321 2.jpg"
      ]
    }
  ]
}
