{
  "titel": "Wanderkonzert",
  "datum": "2020-10-24",
  "tags": [
    "Konzert"
  ],
  "beschreibung": "Ein musikalischer Rückblick aus dem Jahr 2020.",
  "detailbild": "concert/wanderkonzert.jpg",
  "concert": {
    "titel": "Wanderkonzert",
    "datum": "2020",
    "beschreibung": "Wanderkonzert",
    "titelbild": "concert/wanderkonzert.jpg"
  }
}
