{
  "titel": "Fotoshooting Eberlehof",
  "datum": "2015",
  "tags": [
    "Bilder",
    "Fotoshooting"
  ],
  "beschreibung": "Portraits und Gruppenbilder der Trachtenkapelle.",
  "albums": [
    {
      "id": "2015_Fotoshooting_Eberlehof",
      "titel": "2015 Fotoshooting Eberlehof",
      "datum": "",
      "bilder": [
        "albums/2015_Fotoshooting_Eberlehof/TK_Riezlern_001.jpg",
        "albums/2015_Fotoshooting_Eberlehof/TK_Riezlern_002.jpg",
        "albums/2015_Fotoshooting_Eberlehof/TK_Riezlern_003.jpg",
        "albums/2015_Fotoshooting_Eberlehof/TK_Riezlern_004.jpg",
        "albums/2015_Fotoshooting_Eberlehof/TK_Riezlern_005.jpg",
        "albums/2015_Fotoshooting_Eberlehof/TK_Riezlern_006.jpg",
        "albums/2015_Fotoshooting_Eberlehof/TK_Riezlern_007.jpg",
        "albums/2015_Fotoshooting_Eberlehof/TK_Riezlern_008.jpg",
        "albums/2015_Fotoshooting_Eberlehof/TK_Riezlern_009.jpg",
        "albums/2015_Fotoshooting_Eberlehof/TK_Riezlern_010.jpg",
        "albums/2015_Fotoshooting_Eberlehof/TK_Riezlern_011.jpg",
        "albums/2015_Fotoshooting_Eberlehof/TK_Riezlern_013.jpg",
        "albums/2015_Fotoshooting_Eberlehof/TK_Riezlern_014.jpg",
        "albums/2015_Fotoshooting_Eberlehof/TK_Riezlern_015.jpg",
        "albums/2015_Fotoshooting_Eberlehof/TK_Riezlern_016.jpg",
        "albums/2015_Fotoshooting_Eberlehof/TK_Riezlern_017.jpg",
        "albums/2015_Fotoshooting_Eberlehof/TK_Riezlern_018.jpg",
        "albums/2015_Fotoshooting_Eberlehof/TK_Riezlern_019.jpg",
        "albums/2015_Fotoshooting_Eberlehof/TK_Riezlern_020.jpg",
        "albums/2015_Fotoshooting_Eberlehof/TK_Riezlern_021.jpg",
        "albums/2015_Fotoshooting_Eberlehof/TK_Riezlern_022.jpg",
        "albums/2015_Fotoshooting_Eberlehof/TK_Riezlern_023.jpg",
        "albums/2015_Fotoshooting_Eberlehof/TK_Riezlern_024.jpg",
        "albums/2015_Fotoshooting_Eberlehof/TK_Riezlern_025.jpg",
        "albums/2015_Fotoshooting_Eberlehof/TK_Riezlern_026.jpg",
        "albums/2015_Fotoshooting_Eberlehof/TK_Riezlern_027.jpg",
        "albums/2015_Fotoshooting_Eberlehof/TK_Riezlern_028.jpg",
        "albums/2015_Fotoshooting_Eberlehof/TK_Riezlern_029.jpg",
        "albums/2015_Fotoshooting_Eberlehof/TK_Riezlern_030.jpg",
        "albums/2015_Fotoshooting_Eberlehof/TK_Riezlern_031.jpg",
        "albums/2015_Fotoshooting_Eberlehof/TK_Riezlern_032.jpg",
        "albums/2015_Fotoshooting_Eberlehof/TK_Riezlern_033.jpg",
        "albums/2015_Fotoshooting_Eberlehof/TK_Riezlern_034.jpg",
        "albums/2015_Fotoshooting_Eberlehof/TK_Riezlern_035.jpg",
        "albums/2015_Fotoshooting_Eberlehof/TK_Riezlern_036.jpg",
        "albums/2015_Fotoshooting_Eberlehof/TK_Riezlern_037.jpg",
        "albums/2015_Fotoshooting_Eberlehof/TK_Riezlern_038.jpg",
        "albums/2015_Fotoshooting_Eberlehof/TK_Riezlern_039.jpg",
        "albums/2015_Fotoshooting_Eberlehof/TK_Riezlern_040.jpg",
        "albums/2015_Fotoshooting_Eberlehof/TK_Riezlern_041.jpg",
        "albums/2015_Fotoshooting_Eberlehof/TK_Riezlern_042.jpg",
        "albums/2015_Fotoshooting_Eberlehof/TK_Riezlern_043.jpg",
        "albums/2015_Fotoshooting_Eberlehof/TK_Riezlern_044.jpg",
        "albums/2015_Fotoshooting_Eberlehof/TK_Riezlern_045.jpg",
        "albums/2015_Fotoshooting_Eberlehof/TK_Riezlern_046.jpg",
        "albums/2015_Fotoshooting_Eberlehof/TK_Riezlern_047.jpg",
        "albums/2015_Fotoshooting_Eberlehof/TK_Riezlern_048.jpg",
        "albums/2015_Fotoshooting_Eberlehof/TK_Riezlern_049.jpg",
        "albums/2015_Fotoshooting_Eberlehof/TK_Riezlern_050.jpg",
        "albums/2015_Fotoshooting_Eberlehof/TK_Riezlern_051.jpg",
        "albums/2015_Fotoshooting_Eberlehof/TK_Riezlern_052.jpg",
        "albums/2015_Fotoshooting_Eberlehof/TK_Riezlern_053.jpg",
        "albums/2015_Fotoshooting_Eberlehof/TK_Riezlern_054.jpg",
        "albums/2015_Fotoshooting_Eberlehof/TK_Riezlern_055.jpg",
        "albums/2015_Fotoshooting_Eberlehof/TK_Riezlern_056.jpg",
        "albums/2015_Fotoshooting_Eberlehof/TK_Riezlern_057.jpg",
        "albums/2015_Fotoshooting_Eberlehof/TK_Riezlern_058.jpg",
        "albums/2015_Fotoshooting_Eberlehof/TK_Riezlern_059.jpg",
        "albums/2015_Fotoshooting_Eberlehof/TK_Riezlern_060.jpg",
        "albums/2015_Fotoshooting_Eberlehof/TK_Riezlern_061.jpg",
        "albums/2015_Fotoshooting_Eberlehof/TK_Riezlern_062.jpg",
        "albums/2015_Fotoshooting_Eberlehof/TK_Riezlern_063.jpg",
        "albums/2015_Fotoshooting_Eberlehof/TK_Riezlern_064.jpg",
        "albums/2015_Fotoshooting_Eberlehof/TK_Riezlern_065.jpg",
        "albums/2015_Fotoshooting_Eberlehof/TK_Riezlern_066.jpg",
        "albums/2015_Fotoshooting_Eberlehof/TK_Riezlern_067.jpg"
      ]
    }
  ]
}
