{
  "titel": "Tag der Blasmusik 2013",
  "datum": "2013-08-15",
  "tags": [
    "Bilder",
    "Verein"
  ],
  "beschreibung": "Bilder vom Tag der Blasmusik.",
  "albums": [
    {
      "id": "2013_Tag_der_Blasmusik",
      "titel": "Tag der Blasmusik 2013",
      "datum": "",
      "bilder": [
        "albums/2013_Tag_der_Blasmusik/IMG_8137.JPG",
        "albums/2013_Tag_der_Blasmusik/IMG_8138.JPG",
        "albums/2013_Tag_der_Blasmusik/IMG_8139.JPG",
        "albums/2013_Tag_der_Blasmusik/IMG_8140.JPG",
        "albums/2013_Tag_der_Blasmusik/IMG_8142.JPG",
        "albums/2013_Tag_der_Blasmusik/IMG_8143.JPG",
        "albums/2013_Tag_der_Blasmusik/IMG_8144.JPG",
        "albums/2013_Tag_der_Blasmusik/IMG_8145.JPG",
        "albums/2013_Tag_der_Blasmusik/IMG_8146.JPG",
        "albums/2013_Tag_der_Blasmusik/IMG_8147.JPG",
        "albums/2013_Tag_der_Blasmusik/IMG_8148.JPG",
        "albums/2013_Tag_der_Blasmusik/IMG_8149.JPG",
        "albums/2013_Tag_der_Blasmusik/IMG_8150.JPG",
        "albums/2013_Tag_der_Blasmusik/IMG_8151.JPG",
        "albums/2013_Tag_der_Blasmusik/IMG_8152.JPG",
        "albums/2013_Tag_der_Blasmusik/IMG_8153.JPG",
        "albums/2013_Tag_der_Blasmusik/IMG_8154.JPG",
        "albums/2013_Tag_der_Blasmusik/IMG_8155.JPG",
        "albums/2013_Tag_der_Blasmusik/IMG_8156.JPG",
        "albums/2013_Tag_der_Blasmusik/IMG_8157.JPG",
        "albums/2013_Tag_der_Blasmusik/IMG_8159.JPG",
        "albums/2013_Tag_der_Blasmusik/IMG_8160.JPG",
        "albums/2013_Tag_der_Blasmusik/IMG_8161.JPG",
        "albums/2013_Tag_der_Blasmusik/IMG_8162.JPG",
        "albums/2013_Tag_der_Blasmusik/IMG_8163.JPG",
        "albums/2013_Tag_der_Blasmusik/IMG_8164.JPG",
        "albums/2013_Tag_der_Blasmusik/IMG_8165.JPG",
        "albums/2013_Tag_der_Blasmusik/IMG_8166.JPG",
        "albums/2013_Tag_der_Blasmusik/IMG_8167.JPG",
        "albums/2013_Tag_der_Blasmusik/IMG_8173.JPG",
        "albums/2013_Tag_der_Blasmusik/IMG_8174.JPG",
        "albums/2013_Tag_der_Blasmusik/IMG_8175.JPG",
        "albums/2013_Tag_der_Blasmusik/IMG_8176.JPG",
        "albums/2013_Tag_der_Blasmusik/IMG_8177.JPG",
        "albums/2013_Tag_der_Blasmusik/IMG_8178.JPG",
        "albums/2013_Tag_der_Blasmusik/IMG_8179.JPG",
        "albums/2013_Tag_der_Blasmusik/IMG_8180.JPG",
        "albums/2013_Tag_der_Blasmusik/IMG_8181.JPG",
        "albums/2013_Tag_der_Blasmusik/IMG_8182.JPG",
        "albums/2013_Tag_der_Blasmusik/IMG_8183.JPG",
        "albums/2013_Tag_der_Blasmusik/IMG_8184.JPG",
        "albums/2013_Tag_der_Blasmusik/IMG_8187.JPG",
        "albums/2013_Tag_der_Blasmusik/IMG_8188.JPG",
        "albums/2013_Tag_der_Blasmusik/IMG_8189.JPG",
        "albums/2013_Tag_der_Blasmusik/IMG_8190.JPG",
        "albums/2013_Tag_der_Blasmusik/IMG_8191.JPG",
        "albums/2013_Tag_der_Blasmusik/IMG_8192.JPG",
        "albums/2013_Tag_der_Blasmusik/IMG_8193.JPG",
        "albums/2013_Tag_der_Blasmusik/IMG_8194.JPG",
        "albums/2013_Tag_der_Blasmusik/IMG_8195.JPG",
        "albums/2013_Tag_der_Blasmusik/IMG_8196.JPG",
        "albums/2013_Tag_der_Blasmusik/IMG_8197.JPG",
        "albums/2013_Tag_der_Blasmusik/IMG_8198.JPG",
        "albums/2013_Tag_der_Blasmusik/IMG_8199.JPG",
        "albums/2013_Tag_der_Blasmusik/IMG_8200.JPG",
        "albums/2013_Tag_der_Blasmusik/IMG_8201.JPG",
        "albums/2013_Tag_der_Blasmusik/IMG_8202.JPG",
        "albums/2013_Tag_der_Blasmusik/IMG_8203.JPG",
        "albums/2013_Tag_der_Blasmusik/IMG_8204.JPG",
        "albums/2013_Tag_der_Blasmusik/IMG_8205.JPG",
        "albums/2013_Tag_der_Blasmusik/IMG_8206.JPG",
        "albums/2013_Tag_der_Blasmusik/IMG_8207.JPG",
        "albums/2013_Tag_der_Blasmusik/IMG_8208.JPG",
        "albums/2013_Tag_der_Blasmusik/IMG_8209.JPG",
        "albums/2013_Tag_der_Blasmusik/IMG_8210.JPG",
        "albums/2013_Tag_der_Blasmusik/IMG_8211.JPG",
        "albums/2013_Tag_der_Blasmusik/IMG_8212.JPG",
        "albums/2013_Tag_der_Blasmusik/IMG_8213.JPG",
        "albums/2013_Tag_der_Blasmusik/IMG_8214.JPG",
        "albums/2013_Tag_der_Blasmusik/IMG_8215.JPG",
        "albums/2013_Tag_der_Blasmusik/IMG_8216.JPG",
        "albums/2013_Tag_der_Blasmusik/IMG_8217.JPG",
        "albums/2013_Tag_der_Blasmusik/IMG_8218.JPG",
        "albums/2013_Tag_der_Blasmusik/IMG_8219.JPG",
        "albums/2013_Tag_der_Blasmusik/IMG_8220.JPG",
        "albums/2013_Tag_der_Blasmusik/IMG_8221.JPG",
        "albums/2013_Tag_der_Blasmusik/IMG_8222.JPG",
        "albums/2013_Tag_der_Blasmusik/IMG_8223.JPG",
        "albums/2013_Tag_der_Blasmusik/IMG_8224.JPG",
        "albums/2013_Tag_der_Blasmusik/IMG_8225.JPG",
        "albums/2013_Tag_der_Blasmusik/IMG_8226.JPG",
        "albums/2013_Tag_der_Blasmusik/IMG_8227.JPG",
        "albums/2013_Tag_der_Blasmusik/IMG_8228.JPG",
        "albums/2013_Tag_der_Blasmusik/IMG_8229.JPG",
        "albums/2013_Tag_der_Blasmusik/IMG_8230.JPG",
        "albums/2013_Tag_der_Blasmusik/IMG_8231.JPG",
        "albums/2013_Tag_der_Blasmusik/IMG_8232.JPG",
        "albums/2013_Tag_der_Blasmusik/IMG_8233.JPG",
        "albums/2013_Tag_der_Blasmusik/IMG_8234.JPG",
        "albums/2013_Tag_der_Blasmusik/IMG_8235.JPG",
        "albums/2013_Tag_der_Blasmusik/IMG_8236.JPG",
        "albums/2013_Tag_der_Blasmusik/IMG_8237.JPG",
        "albums/2013_Tag_der_Blasmusik/IMG_8238.JPG",
        "albums/2013_Tag_der_Blasmusik/IMG_8239.JPG",
        "albums/2013_Tag_der_Blasmusik/IMG_8240.JPG",
        "albums/2013_Tag_der_Blasmusik/IMG_8241.JPG",
        "albums/2013_Tag_der_Blasmusik/IMG_8242.JPG",
        "albums/2013_Tag_der_Blasmusik/IMG_8243.JPG",
        "albums/2013_Tag_der_Blasmusik/IMG_8244.JPG",
        "albums/2013_Tag_der_Blasmusik/IMG_8245.JPG",
        "albums/2013_Tag_der_Blasmusik/IMG_8246.JPG",
        "albums/2013_Tag_der_Blasmusik/IMG_8247.JPG",
        "albums/2013_Tag_der_Blasmusik/IMG_8248.JPG",
        "albums/2013_Tag_der_Blasmusik/IMG_8249.JPG",
        "albums/2013_Tag_der_Blasmusik/IMG_8250.JPG",
        "albums/2013_Tag_der_Blasmusik/IMG_8251.JPG",
        "albums/2013_Tag_der_Blasmusik/IMG_8252.JPG",
        "albums/2013_Tag_der_Blasmusik/IMG_8253.JPG",
        "albums/2013_Tag_der_Blasmusik/IMG_8254.JPG",
        "albums/2013_Tag_der_Blasmusik/IMG_8255.JPG",
        "albums/2013_Tag_der_Blasmusik/IMG_8256.JPG",
        "albums/2013_Tag_der_Blasmusik/IMG_8257.JPG",
        "albums/2013_Tag_der_Blasmusik/IMG_8258.JPG",
        "albums/2013_Tag_der_Blasmusik/IMG_8259.JPG",
        "albums/2013_Tag_der_Blasmusik/IMG_8260.JPG",
        "albums/2013_Tag_der_Blasmusik/IMG_8261.JPG",
        "albums/2013_Tag_der_Blasmusik/IMG_8262.JPG",
        "albums/2013_Tag_der_Blasmusik/IMG_8263.JPG",
        "albums/2013_Tag_der_Blasmusik/IMG_8264.JPG",
        "albums/2013_Tag_der_Blasmusik/IMG_8265.JPG",
        "albums/2013_Tag_der_Blasmusik/IMG_8266.JPG",
        "albums/2013_Tag_der_Blasmusik/IMG_8267.JPG",
        "albums/2013_Tag_der_Blasmusik/IMG_8268.JPG",
        "albums/2013_Tag_der_Blasmusik/IMG_8269.JPG",
        "albums/2013_Tag_der_Blasmusik/IMG_8270.JPG",
        "albums/2013_Tag_der_Blasmusik/IMG_8271.JPG",
        "albums/2013_Tag_der_Blasmusik/IMG_8272.JPG",
        "albums/2013_Tag_der_Blasmusik/IMG_8273.JPG",
        "albums/2013_Tag_der_Blasmusik/IMG_8274.JPG",
        "albums/2013_Tag_der_Blasmusik/IMG_8275.JPG",
        "albums/2013_Tag_der_Blasmusik/IMG_8276.JPG",
        "albums/2013_Tag_der_Blasmusik/IMG_8277.JPG",
        "albums/2013_Tag_der_Blasmusik/IMG_8278.JPG"
      ]
    }
  ]
}
