{
  "titel": "Jahreskonzert 2024 – Momentaufnahmen",
  "datum": "2024-05-04",
  "tags": [
    "Konzert",
    "Jahreskonzert"
  ],
  "beschreibung": "Momentaufnahmen an unserem Jahreskonzert 2024.",
  "detailbild": "concert/programm.jpg",
  "inhalt": "<p>Wir präsentieren bei unserem Jahreskonzert am Samstag, den 4. Mai 2024 um 20.00 Uhr klangvolle Erinnerungen unter dem Titel <b>„Momentaufnahmen“</b> im Walserhaus Hirschegg und laden Euch alle herzlich dazu ein!</p><p>Ob Kindheit, Urlaub, die große Liebe, Mut oder Freundschaft – besondere Augenblicke und Momente nehmen wir tief in uns auf, bis sie zu Erinnerungen werden. Wir werden Momentaufnahmen aus verschiedenen Lebensphasen und Erlebnissen mitreißend zum Klingen bringen und Euer Kopfkino in Gang setzen.</p><p>Das Repertoire des Abends ist so vielfältig wie das Leben selbst: Mit „Hänsel und Gretel“ oder „A Childhood Remembered“ lebt ein Stück Kindheit wieder auf, Johann Strauß lässt an den letzten Urlaub zurückdenken und „Das Geheimnis der Weißen Rose“, erinnert an den unvergesslichen Mut von Sophie Scholl und den Widerstandskämpfern der Weißen Rose. Als musikalischer Reiseführer nimmt uns Akkordeonsolist Bernhard Oss aus Oberstdorf mit durch die Straßen von Paris Montmartre und Maria Beier tauscht für Edith Piafs „Non, je ne regrette rien“ das Waldhorn gegen das Mikrofon. Mit Thomas Berchtold und Andi Fauland kommen gleich zwei Solisten – an Klarinette und Schreibmaschine –  bei Leroy Andersons „Typewriter“ zum Einsatz.</p><p>Wir sind gespannt auch auf die Zusammenarbeit mit dem Karl-Max-Kessler Archiv als „fotografisches Gedächtnis“ der Entwicklung des Kleinwalsertals in der ersten Hälfte des vergangenen Jahrhunderts. Die (Moment)Aufnahmen aus dem Archiv werden unser und Euer Konzerterlebnis bereichern.</p><p>Mit über 40 Musikantinnen und Musikanten unter der Leitung von Katrin Berchtold freuen wir uns über ein großes Publikum und ein Konzerterlebnis, das als Momentaufnahme zur Erinnerung wird.</p>",
  "concert": {
    "titel": "Jahreskonzert 2024 – Momentaufnahmen",
    "datum": "2024",
    "beschreibung": "Das Programm unseres Jahreskonzerts 2024 unter dem Motto „Momentaufnahmen“."
  }
}
