{
  "titel": "Bundesmusikfest Wien",
  "datum": "2015",
  "tags": [
    "Bilder",
    "Auswärts"
  ],
  "beschreibung": "Bilder vom Bundesmusikfest in Wien.",
  "albums": [
    {
      "id": "2015_Bundesmusikfest_Wien",
      "titel": "2015 Bundesmusikfest Wien",
      "datum": "",
      "bilder": [
        "albums/2015_Bundesmusikfest_Wien/TU5A1536.JPG",
        "albums/2015_Bundesmusikfest_Wien/TU5A1539.JPG",
        "albums/2015_Bundesmusikfest_Wien/TU5A1542.JPG",
        "albums/2015_Bundesmusikfest_Wien/TU5A1543.JPG",
        "albums/2015_Bundesmusikfest_Wien/TU5A1544.JPG",
        "albums/2015_Bundesmusikfest_Wien/TU5A1545.JPG",
        "albums/2015_Bundesmusikfest_Wien/TU5A1548.JPG",
        "albums/2015_Bundesmusikfest_Wien/TU5A1549.JPG",
        "albums/2015_Bundesmusikfest_Wien/TU5A1550.JPG",
        "albums/2015_Bundesmusikfest_Wien/TU5A1551.JPG",
        "albums/2015_Bundesmusikfest_Wien/TU5A1552.JPG",
        "albums/2015_Bundesmusikfest_Wien/TU5A1553.JPG",
        "albums/2015_Bundesmusikfest_Wien/TU5A1560.JPG",
        "albums/2015_Bundesmusikfest_Wien/TU5A1561.JPG",
        "albums/2015_Bundesmusikfest_Wien/TU5A1565.JPG",
        "albums/2015_Bundesmusikfest_Wien/TU5A1567.JPG",
        "albums/2015_Bundesmusikfest_Wien/TU5A1568.JPG",
        "albums/2015_Bundesmusikfest_Wien/TU5A1571.JPG",
        "albums/2015_Bundesmusikfest_Wien/TU5A1572.JPG",
        "albums/2015_Bundesmusikfest_Wien/TU5A1573.JPG",
        "albums/2015_Bundesmusikfest_Wien/TU5A1574.JPG",
        "albums/2015_Bundesmusikfest_Wien/TU5A1575.JPG",
        "albums/2015_Bundesmusikfest_Wien/TU5A1576.JPG",
        "albums/2015_Bundesmusikfest_Wien/TU5A1577.JPG",
        "albums/2015_Bundesmusikfest_Wien/TU5A1578.JPG",
        "albums/2015_Bundesmusikfest_Wien/TU5A1579.JPG",
        "albums/2015_Bundesmusikfest_Wien/TU5A1580.JPG",
        "albums/2015_Bundesmusikfest_Wien/TU5A1581.JPG",
        "albums/2015_Bundesmusikfest_Wien/TU5A1582.JPG",
        "albums/2015_Bundesmusikfest_Wien/TU5A1583.JPG",
        "albums/2015_Bundesmusikfest_Wien/TU5A1584.JPG",
        "albums/2015_Bundesmusikfest_Wien/TU5A1585.JPG",
        "albums/2015_Bundesmusikfest_Wien/TU5A1586.JPG",
        "albums/2015_Bundesmusikfest_Wien/TU5A1587.JPG",
        "albums/2015_Bundesmusikfest_Wien/TU5A1588.JPG",
        "albums/2015_Bundesmusikfest_Wien/TU5A1589.JPG",
        "albums/2015_Bundesmusikfest_Wien/TU5A1590.JPG",
        "albums/2015_Bundesmusikfest_Wien/TU5A1591.JPG",
        "albums/2015_Bundesmusikfest_Wien/TU5A1592.JPG",
        "albums/2015_Bundesmusikfest_Wien/TU5A1593.JPG",
        "albums/2015_Bundesmusikfest_Wien/TU5A1594.JPG",
        "albums/2015_Bundesmusikfest_Wien/TU5A1595.JPG",
        "albums/2015_Bundesmusikfest_Wien/TU5A1596.JPG",
        "albums/2015_Bundesmusikfest_Wien/TU5A1597.JPG",
        "albums/2015_Bundesmusikfest_Wien/TU5A1598.JPG",
        "albums/2015_Bundesmusikfest_Wien/TU5A1599.JPG",
        "albums/2015_Bundesmusikfest_Wien/TU5A1600.JPG",
        "albums/2015_Bundesmusikfest_Wien/TU5A1601.JPG",
        "albums/2015_Bundesmusikfest_Wien/TU5A1602.JPG",
        "albums/2015_Bundesmusikfest_Wien/TU5A1603.JPG",
        "albums/2015_Bundesmusikfest_Wien/TU5A1604.JPG",
        "albums/2015_Bundesmusikfest_Wien/TU5A1605.JPG",
        "albums/2015_Bundesmusikfest_Wien/TU5A1606.JPG",
        "albums/2015_Bundesmusikfest_Wien/TU5A1607.JPG",
        "albums/2015_Bundesmusikfest_Wien/TU5A1608.JPG",
        "albums/2015_Bundesmusikfest_Wien/TU5A1609.JPG",
        "albums/2015_Bundesmusikfest_Wien/TU5A1610.JPG",
        "albums/2015_Bundesmusikfest_Wien/TU5A1611.JPG",
        "albums/2015_Bundesmusikfest_Wien/TU5A1612.JPG",
        "albums/2015_Bundesmusikfest_Wien/TU5A1614.JPG",
        "albums/2015_Bundesmusikfest_Wien/TU5A1615.JPG",
        "albums/2015_Bundesmusikfest_Wien/TU5A1616.JPG",
        "albums/2015_Bundesmusikfest_Wien/TU5A1618.JPG",
        "albums/2015_Bundesmusikfest_Wien/TU5A1619.JPG",
        "albums/2015_Bundesmusikfest_Wien/TU5A1622.JPG",
        "albums/2015_Bundesmusikfest_Wien/TU5A1623.JPG",
        "albums/2015_Bundesmusikfest_Wien/TU5A1628.JPG",
        "albums/2015_Bundesmusikfest_Wien/TU5A1629.JPG",
        "albums/2015_Bundesmusikfest_Wien/TU5A1630.JPG",
        "albums/2015_Bundesmusikfest_Wien/TU5A1632.JPG",
        "albums/2015_Bundesmusikfest_Wien/TU5A1633.JPG",
        "albums/2015_Bundesmusikfest_Wien/TU5A1634.JPG",
        "albums/2015_Bundesmusikfest_Wien/TU5A2101.JPG",
        "albums/2015_Bundesmusikfest_Wien/TU5A2102.JPG",
        "albums/2015_Bundesmusikfest_Wien/TU5A2103.JPG",
        "albums/2015_Bundesmusikfest_Wien/TU5A2104.JPG",
        "albums/2015_Bundesmusikfest_Wien/TU5A2105.JPG",
        "albums/2015_Bundesmusikfest_Wien/TU5A2106.JPG",
        "albums/2015_Bundesmusikfest_Wien/TU5A2107.JPG",
        "albums/2015_Bundesmusikfest_Wien/TU5A2108.JPG",
        "albums/2015_Bundesmusikfest_Wien/TU5A2109.JPG",
        "albums/2015_Bundesmusikfest_Wien/TU5A2110.JPG",
        "albums/2015_Bundesmusikfest_Wien/TU5A2112.JPG",
        "albums/2015_Bundesmusikfest_Wien/TU5A2113.JPG",
        "albums/2015_Bundesmusikfest_Wien/TU5A2120.JPG",
        "albums/2015_Bundesmusikfest_Wien/TU5A2121.JPG",
        "albums/2015_Bundesmusikfest_Wien/TU5A2122.JPG",
        "albums/2015_Bundesmusikfest_Wien/TU5A2126.JPG",
        "albums/2015_Bundesmusikfest_Wien/TU5A2129.JPG",
        "albums/2015_Bundesmusikfest_Wien/TU5A2130.JPG",
        "albums/2015_Bundesmusikfest_Wien/TU5A2131.JPG",
        "albums/2015_Bundesmusikfest_Wien/TU5A2132.JPG",
        "albums/2015_Bundesmusikfest_Wien/TU5A2135.JPG",
        "albums/2015_Bundesmusikfest_Wien/TU5A2142.JPG",
        "albums/2015_Bundesmusikfest_Wien/TU5A2146.JPG",
        "albums/2015_Bundesmusikfest_Wien/TU5A2149.JPG",
        "albums/2015_Bundesmusikfest_Wien/TU5A2151.JPG",
        "albums/2015_Bundesmusikfest_Wien/TU5A2155.JPG",
        "albums/2015_Bundesmusikfest_Wien/TU5A2163.JPG",
        "albums/2015_Bundesmusikfest_Wien/TU5A2164.JPG",
        "albums/2015_Bundesmusikfest_Wien/TU5A2167.JPG",
        "albums/2015_Bundesmusikfest_Wien/TU5A2168.JPG",
        "albums/2015_Bundesmusikfest_Wien/TU5A2172.JPG",
        "albums/2015_Bundesmusikfest_Wien/TU5A2174.JPG",
        "albums/2015_Bundesmusikfest_Wien/TU5A2175.JPG",
        "albums/2015_Bundesmusikfest_Wien/TU5A2179.JPG",
        "albums/2015_Bundesmusikfest_Wien/TU5A2185.JPG"
      ]
    }
  ]
}
